{
  "_synthetic": true,
  "_notice": "SYNTHETIC DATA — fictional persons, generated for the Quantic AI Engineering project. No real employee information.",
  "_generator": "scripts/gen_mock_data.py seed=1729",
  "as_of": "2026-09-01",
  "records": [
    {
      "employee_id": "E1002",
      "preferred_name": "Miguel",
      "legal_name": "Miguel Ferreira",
      "email": "miguel.ferreira@mosaicrobotics.example",
      "work_phone": "+1-555-0107",
      "title": "VP Engineering",
      "department": "Engineering",
      "employment_type": "full_time",
      "fte": 1.0,
      "hire_date": "2019-06-17",
      "tenure_months_at_as_of": 86,
      "level": "L9",
      "office_id": "atx",
      "work_country": "US",
      "work_arrangement": "hybrid",
      "manager_id": "E1003",
      "cost_center": "CC-1200"
    },
    {
      "employee_id": "E1003",
      "preferred_name": "Nadine",
      "legal_name": "Nadine Alarcon",
      "email": "nadine.alarcon@mosaicrobotics.example",
      "work_phone": "+1-555-0106",
      "title": "Chief Executive Officer",
      "department": "Executive",
      "employment_type": "full_time",
      "fte": 1.0,
      "hire_date": "2018-03-05",
      "tenure_months_at_as_of": 101,
      "level": "L10",
      "office_id": "atx",
      "work_country": "US",
      "work_arrangement": "hybrid",
      "manager_id": null,
      "cost_center": "CC-1000"
    },
    {
      "employee_id": "E1007",
      "preferred_name": "Dana",
      "legal_name": "Dana Whitfield",
      "email": "dana.whitfield@mosaicrobotics.example",
      "work_phone": "+1-555-0128",
      "title": "Director, Engineering",
      "department": "Engineering",
      "employment_type": "full_time",
      "fte": 1.0,
      "hire_date": "2020-02-24",
      "tenure_months_at_as_of": 78,
      "level": "L8",
      "office_id": "bos",
      "work_country": "US",
      "work_arrangement": "hybrid",
      "manager_id": "E1002",
      "cost_center": "CC-1210"
    },
    {
      "employee_id": "E1014",
      "preferred_name": "Adaeze",
      "legal_name": "Adaeze Okonkwo",
      "email": "adaeze.okonkwo@mosaicrobotics.example",
      "work_phone": "+1-555-0112",
      "title": "VP People Operations",
      "department": "People Operations",
      "employment_type": "full_time",
      "fte": 1.0,
      "hire_date": "2019-09-02",
      "tenure_months_at_as_of": 83,
      "level": "L9",
      "office_id": "atx",
      "work_country": "US",
      "work_arrangement": "hybrid",
      "manager_id": "E1003",
      "cost_center": "CC-1600"
    },
    {
      "employee_id": "E1017",
      "preferred_name": "Tomasz",
      "legal_name": "Tomasz Wierzbicki",
      "email": "tomasz.wierzbicki@mosaicrobotics.example",
      "work_phone": "+1-555-0138",
      "title": "Director, Manufacturing",
      "department": "Manufacturing",
      "employment_type": "full_time",
      "fte": 1.0,
      "hire_date": "2020-07-13",
      "tenure_months_at_as_of": 73,
      "level": "L8",
      "office_id": "atx",
      "work_country": "US",
      "work_arrangement": "onsite",
      "manager_id": "E1003",
      "cost_center": "CC-1400"
    },
    {
      "employee_id": "E1042",
      "preferred_name": "Priya",
      "legal_name": "Priya Raghavan",
      "email": "priya.raghavan@mosaicrobotics.example",
      "work_phone": "+1-555-0147",
      "title": "Senior Robotics Engineer",
      "department": "Engineering",
      "employment_type": "full_time",
      "fte": 1.0,
      "hire_date": "2022-11-13",
      "tenure_months_at_as_of": 45,
      "level": "L5",
      "office_id": "bos",
      "work_country": "US",
      "work_arrangement": "hybrid",
      "manager_id": "E1007",
      "cost_center": "CC-1210"
    },
    {
      "employee_id": "E1043",
      "preferred_name": "Renata",
      "legal_name": "Renata Villalobos",
      "email": "renata.villalobos@mosaicrobotics.example",
      "work_phone": "+1-555-0144",
      "title": "Director, Sales",
      "department": "Sales",
      "employment_type": "full_time",
      "fte": 1.0,
      "hire_date": "2021-01-11",
      "tenure_months_at_as_of": 67,
      "level": "L8",
      "office_id": "remote-us",
      "work_country": "US",
      "work_arrangement": "remote",
      "manager_id": "E1003",
      "cost_center": "CC-1500"
    },
    {
      "employee_id": "E1047",
      "preferred_name": "Katrin",
      "legal_name": "Katrin Hoffmann",
      "email": "katrin.hoffmann@mosaicrobotics.example",
      "work_phone": "+1-555-0145",
      "title": "Site Director, Berlin",
      "department": "Operations",
      "employment_type": "full_time",
      "fte": 1.0,
      "hire_date": "2021-04-06",
      "tenure_months_at_as_of": 64,
      "level": "L8",
      "office_id": "ber",
      "work_country": "DE",
      "work_arrangement": "onsite",
      "manager_id": "E1003",
      "cost_center": "CC-1900"
    },
    {
      "employee_id": "E1050",
      "preferred_name": "Wes",
      "legal_name": "Weston Ackroyd",
      "email": "weston.ackroyd@mosaicrobotics.example",
      "work_phone": "+1-555-0148",
      "title": "Staff Software Engineer",
      "department": "Engineering",
      "employment_type": "full_time",
      "fte": 1.0,
      "hire_date": "2021-08-30",
      "tenure_months_at_as_of": 60,
      "level": "L6",
      "office_id": "bos",
      "work_country": "US",
      "work_arrangement": "hybrid",
      "manager_id": "E1007",
      "cost_center": "CC-1210"
    },
    {
      "employee_id": "E1057",
      "preferred_name": "Yuki",
      "legal_name": "Yuki Tanabe",
      "email": "yuki.tanabe@mosaicrobotics.example",
      "work_phone": "+1-555-0150",
      "title": "Robotics Engineer II",
      "department": "Engineering",
      "employment_type": "full_time",
      "fte": 1.0,
      "hire_date": "2024-03-04",
      "tenure_months_at_as_of": 29,
      "level": "L4",
      "office_id": "remote-us",
      "work_country": "US",
      "work_arrangement": "remote",
      "manager_id": "E1007",
      "cost_center": "CC-1210"
    },
    {
      "employee_id": "E1077",
      "preferred_name": "Ola",
      "legal_name": "Olamide Adeyemi",
      "email": "olamide.adeyemi@mosaicrobotics.example",
      "work_phone": "+1-555-0151",
      "title": "Firmware Engineer",
      "department": "Engineering",
      "employment_type": "full_time",
      "fte": 1.0,
      "hire_date": "2023-05-22",
      "tenure_months_at_as_of": 39,
      "level": "L4",
      "office_id": "atx",
      "work_country": "US",
      "work_arrangement": "hybrid",
      "manager_id": "E1007",
      "cost_center": "CC-1220"
    },
    {
      "employee_id": "E1078",
      "preferred_name": "Ines",
      "legal_name": "Ines Duarte",
      "email": "ines.duarte@mosaicrobotics.example",
      "work_phone": "+1-555-0152",
      "title": "Controls Engineer",
      "department": "Engineering",
      "employment_type": "full_time",
      "fte": 1.0,
      "hire_date": "2022-02-07",
      "tenure_months_at_as_of": 54,
      "level": "L5",
      "office_id": "ber",
      "work_country": "DE",
      "work_arrangement": "hybrid",
      "manager_id": "E1047",
      "cost_center": "CC-1910"
    },
    {
      "employee_id": "E1096",
      "preferred_name": "Bea",
      "legal_name": "Beatriz Mendes",
      "email": "beatriz.mendes@mosaicrobotics.example",
      "work_phone": "+1-555-0169",
      "title": "QA Automation Engineer",
      "department": "Engineering",
      "employment_type": "part_time",
      "fte": 0.6,
      "hire_date": "2023-10-02",
      "tenure_months_at_as_of": 34,
      "level": "L4",
      "office_id": "remote-us",
      "work_country": "US",
      "work_arrangement": "remote",
      "manager_id": "E1007",
      "cost_center": "CC-1230"
    },
    {
      "employee_id": "E1108",
      "preferred_name": "Marcus",
      "legal_name": "Marcus Feldman",
      "email": "marcus.feldman@mosaicrobotics.example",
      "work_phone": "+1-555-0158",
      "title": "Robotics Engineer I",
      "department": "Engineering",
      "employment_type": "full_time",
      "fte": 1.0,
      "hire_date": "2026-08-15",
      "tenure_months_at_as_of": 0,
      "level": "L3",
      "office_id": "bos",
      "work_country": "US",
      "work_arrangement": "hybrid",
      "manager_id": "E1007",
      "cost_center": "CC-1210"
    },
    {
      "employee_id": "E1110",
      "preferred_name": "Hector",
      "legal_name": "Hector Salgado",
      "email": "hector.salgado@mosaicrobotics.example",
      "work_phone": "+1-555-0170",
      "title": "Manufacturing Technician",
      "department": "Manufacturing",
      "employment_type": "full_time",
      "fte": 1.0,
      "hire_date": "2021-11-08",
      "tenure_months_at_as_of": 57,
      "level": "L3",
      "office_id": "atx",
      "work_country": "US",
      "work_arrangement": "onsite",
      "manager_id": "E1017",
      "cost_center": "CC-1400"
    },
    {
      "employee_id": "E1122",
      "preferred_name": "Junie",
      "legal_name": "Junie Baptiste",
      "email": "junie.baptiste@mosaicrobotics.example",
      "work_phone": "+1-555-0172",
      "title": "Production Planner",
      "department": "Manufacturing",
      "employment_type": "full_time",
      "fte": 1.0,
      "hire_date": "2024-09-16",
      "tenure_months_at_as_of": 23,
      "level": "L4",
      "office_id": "atx",
      "work_country": "US",
      "work_arrangement": "onsite",
      "manager_id": "E1017",
      "cost_center": "CC-1400"
    },
    {
      "employee_id": "E1132",
      "preferred_name": "Sigrid",
      "legal_name": "Sigrid Moller",
      "email": "sigrid.moller@mosaicrobotics.example",
      "work_phone": "+1-555-0173",
      "title": "Quality Inspector",
      "department": "Manufacturing",
      "employment_type": "part_time",
      "fte": 0.8,
      "hire_date": "2022-06-13",
      "tenure_months_at_as_of": 50,
      "level": "L3",
      "office_id": "atx",
      "work_country": "US",
      "work_arrangement": "onsite",